ที่เธอเป็นเธออย่างนี้นะดีอยู่แล้ว,pos
ที่เป็นเธอแบบนี้นะดีอยู่แล้ว,pos
เป็นความธรรมดาที่แสนจะพิเศษ,pos
สำหรับฉันว่ามันดีที่สุดในใจแล้ว,pos
รู้บ้างไหมว่ามันดีที่สุดในใจฉันแล้ว,pos
เพียงเท่านี้ก็น่ารักดีอยู่แล้ว,pos
ที่เธอยิ้มอย่างนี้นะดีอยู่แล้ว,pos
ที่เธอเป็นแบบนี้นะดีอยู่แล้ว,pos
คนที่ฉันต้องการมากมายที่สุดก็คือเธอแค่เพียงผู้เดียวเท่านั้น,pos
ดวงดาวใดเล่าจะงดงามเท่าดวงตาของเธอ (ดวงตาของเธอ),pos
ฉันว่าไม่มีแล้วหญิงงามใดเล่าจะงดงามเท่าดวงใจของเธอ (ดวงใจของเธอ),pos
แบบนี้นะดีอยู่แล้ว,pos
ก่อนเธอจะลาไม่ต้องมาบอกว่ารัก,neg
เห็นไหมว่ามีน้ำตา,neg
ไม่สงสารกันบ้างเลย,neg
ฉันว่าไอ้เรื่องพรรค์นั้นมันน้ำลาย น้ำลาย น้ำลาย,neg
จำเลยจำเป็นต้องยอมจำใจแค่นั้นเอง,neg
สุดท้ายต้องมาโดนเธอเท,neg
เจ็บก็ต้องทน,neg
ต้องแอบร้องจนเลือดปนน้ำตา,neg
รักก็เหมือนระเบิดเวลานาฬิกาติ๊กตอก,neg
แต่ก่อนจะลาอย่ามาพูดดี,neg
ถ้าเธอแค่ไม่ต้องการให้ฉันได้อยู่ตรงนี้,neg
ไม่ต้องมาบอกว่ารัก,neg
รักฉันเพียงเท่านั้น,pos
คำโกหกเหล่านั้น,neg
ทำอะไรไม่ได้คงได้แต่ทำใจ,neg
แต่ฉากสุดท้ายคงเป็นฉันที่เสียใจ,neg
แต่สมองมันไม่เคยจำ,neg
ที่บอกรักกันมันก็แค่น้ำลาย,neg
แต่หากยืนยันจะไปพี่รั้งไม่ได้,neg
แต่จะให้พูดตรงตรงไม่ใช่คนแบบนั้น,neg
เธอฉันก็คนทำไมต้องเหยียบซ้ำ,neg
แม่หน้ามนรู้ว่าเธอเกลียดฉัน,neg
แต่มารยาทนิดนึงคนเคยรักให้เกียรติกันหน่อยสิ,neg
โอ้ ช่างงามเกินจริง,pos
ไม่มีที่ติ เหนือยิ่งทุกสิ่งที่พบเจอมา,pos
เพราะคุณ มีค่ากว่าสิ่งไหน ๆ,pos
มันคงสุขสม มีคุณและผมในงานวิวาห์,pos
จะไม่นอกใจ ให้ซ้ำทรวงใน ดั่งเช่นดารา,pos
ได้โปรดจันทรา บอกวรัญญา ว่าผมรักเธอ,pos
จะทำยังไงก็ไม่รัก,neg
ยังไงก็ไม่แคร์,neg
ไม่เห็นว่าจะมีความหมาย,neg
เธอคงจะไม่รัก,neg
ใช้เวลาที่มีอยู่ในความคิดเฉิ่มเฉิ่ม,neg
รักดีดีที่เธอมีให้กัน,pos
เธอใส่ใจคนอยู่เป็นร้อย,pos
คนถูกใจเธออยู่นับพัน,pos
เธอดูดีในแบบของเธอ,pos
อยู่เป็นความหวังของใครต่อใครให้ไปนานนาน,pos
เป็นที่รักของทุกทุกคน,pos
รู้สึกมันไม่ค่อยดีเหมือนมีอาการหวั่นไหว,neg
ฉันก็นอนไม่ค่อยจะหลับ,neg
ก็ตั้งแต่วันนั้นที่ฉันได้เจอเธอก็เผลอไปคิดว่ามันคือรัก,neg
แต่รู้ตัวอีกทีเธอก็เดินไปจากฉัน,neg
คงจะไม่รอและคงจะไม่หวัง,neg
อย่าปล่อยให้มโน,neg
ถ้าเธอจะทิ้งไว้ให้ช้ำคงไม่โอ,neg
วันคืนที่น่าเบื่อ,neg
มีชีวิตขึ้นทันที,pos
เธอคือพรุ่งนี้ที่ฉันรอ,pos
ทำใจฉันวุ่นวาย,neg
ฝืนฉันฝืนไม่ได้แล้ว,neg
ยอมฉันยอมแพ้เธอไปแล้วไง,neg
รู้แค่เพียงมันโคตรพิเศษเลย,pos
แต่ว่าสิ่งตามมามันอาจเลวร้าย,neg
ฉันจึงทนทนไปไม่อยากให้เธอหาย,neg
ขอบคุณครับ,pos
ก็ยอมแพ้ทุกที,neg
ฉันเป็นเพื่อนที่แสนดี,pos
อยู่ใกล้แค่นี้แต่ไม่กล้าพูดไป,neg
จะไม่มีวันทำให้เธอเสียใจ,pos
คนที่ร่ำลาที่เขาทำเธอเสียใจ,neg
เจ็บ,neg
เจ็บทุกครั้งไป,neg
ที่เห็นเธอผิดหวัง,neg
จากคนที่หมดเยื่อใย,neg
คำที่เธอไม่อยากฟัง,neg
ก็บอกแล้วไงว่าเขาไม่รัก,neg
ก็บอกแล้วไงว่าเขาไม่สนเธอ,neg
ทั้งที่เธอไม่มีหวัง,neg
ก็บอกแล้วไงว่าเขาไม่มา,neg
คอยซับน้ำตาดูแลให้หายดี,neg
อีกนานเท่าไรที่ทั้งหัวใจเธอนั้นจะหายดี,neg
เธอไม่รักกันและคงไม่มอง,neg
ยอมเป็นที่สำรองเก็บน้ำตา,neg
เมื่อเธอเจ็บจากเขามา,neg
เหนื่อยหน่อยนะ,pos
ถ้าเธอยังไม่ถอดใจ,pos
ทั้งว่าเธอไม่มีหวัง,neg
คอยซับน้ำตา (ซับน้ำตา),neg
ดูแลให้หายดี,pos
ถ้าเธอรักเขาฉันก็รักเธออยู่ดี,pos
เธอจะยิ้มกว้างขึ้นทุกที,pos
เวลาที่ได้เฝ้ามองแววตาที่ดูสดใส,pos
ฉันไม่อยากละสายตาไปไหน,pos
ฉันคงทนไม่ได้แน่เลย,neg
ให้ฉันอยู่ตรงนี้ได้คอยดูแลเธอไม่ไปไหน,pos
เมื่อไรที่เธอเศร้าใจอยากทำให้เธอยิ้มได้,pos
เธอรู้ไหมมีใครตรงนี้ที่เขาเฝ้าห่วงใย,pos
แค่เรามีกันอย่างตอนนี้,pos
หากมีเรื่องราวเศร้าใจอยากทำให้เธอยิ้มได้,pos
